[
  {
    "id": 10045434,
    "source": "seek-camp0",
    "formFactor": "mobile",
    "job": {
      "id": 3443
    },
    "candidate": {
      "id": 4988,
      "givenName": "Fred",
      "familyName": "Flintstone"
    },
    "bucketMovements": [
      {
        "key": "incoming",
        "landed": "2017-05-29T01:34:30+00:00"
      },
      {
        "key": "prescreen",
        "landed": "2017-05-29T01:34:30+00:00"
      },
      {
        "key": "interview",
        "landed": "2017-05-29T01:34:30+00:00"
      }
    ],
    "dateLastUpdated": "2017-05-29T01:34:30+00:00"
  },
  {
    "id": 10045437,
    "source": "trademe",
    "formFactor": "desktop",
    "job": {
      "id": 3443
    },
    "candidate": {
      "id": 4988,
      "givenName": "Sheila",
      "familyName": "Jones"
    },
    "bucketMovements": [
      {
        "key": "incoming",
        "landed": "2017-05-29T01:34:30+00:00"
      },
      {
        "key": "prescreen",
        "landed": "2017-05-29T01:34:30+00:00"
      },
      {
        "key": "interview",
        "landed": "2017-05-29T01:34:30+00:00"
      }
    ],
    "dateLastUpdated": "2017-05-29T01:34:30+00:00"
  },
  {
    "id": 10045444,
    "source": "trademe",
    "formFactor": "tablet",
    "job": {
      "id": 3443
    },
    "candidate": {
      "id": 4993,
      "givenName": "Fred",
      "familyName": "Bloggs"
    },
    "bucketMovements": [
      {
        "key": "incoming",
        "landed": "2017-05-29T01:34:30+00:00"
      },
      {
        "key": "prescreen",
        "landed": "2017-05-29T01:34:30+00:00"
      },
      {
        "key": "interview",
        "landed": "2017-05-29T01:34:30+00:00"
      }
    ],
    "dateLastUpdated": "2017-05-29T01:34:30+00:00"
  }
]